{
  "version": "cypher-llm-service-openapi/v1",
  "generatedAt": "2026-05-10",
  "openapi": "3.1.0",
  "info": {
    "title": "Cypher LLM Compiler HTTP API",
    "version": "0.1.0",
    "description": "Machine-readable HTTP contract for the Cypher LLM compiler service. Tool routes use the same schemas as the OpenAI and MCP tool definitions."
  },
  "servers": [
    {
      "url": "http://127.0.0.1:8787",
      "description": "Local compiler service"
    }
  ],
  "security": [],
  "summary": {
    "routes": 35,
    "operations": 35,
    "getRoutes": 11,
    "postRoutes": 24,
    "toolRoutes": 24,
    "publicRoutes": 35,
    "authenticatedRoutes": 0,
    "maxBodyBytes": 1000000
  },
  "paths": {
    "/healthz": {
      "get": {
        "operationId": "health",
        "tags": [
          "service-discovery"
        ],
        "summary": "Return service liveness and tool count.",
        "description": "This discovery route is public for liveness or client bootstrapping.",
        "responses": {
          "200": {
            "description": "Service metadata response.",
            "content": {
              "application/json": {
                "schema": {
                  "type": "object",
                  "additionalProperties": true
                }
              }
            }
          }
        },
        "security": []
      }
    },
    "/v1/service-manifest": {
      "get": {
        "operationId": "service_manifest",
        "tags": [
          "service-discovery"
        ],
        "summary": "Return the compiler service manifest.",
        "description": "This discovery route is public for liveness or client bootstrapping.",
        "responses": {
          "200": {
            "description": "Service metadata response.",
            "content": {
              "application/json": {
                "schema": {
                  "type": "object",
                  "additionalProperties": true
                }
              }
            }
          }
        },
        "security": []
      }
    },
    "/v1/openapi": {
      "get": {
        "operationId": "service_openapi",
        "tags": [
          "service-discovery"
        ],
        "summary": "Return the compiler service OpenAPI contract.",
        "description": "This discovery route is public for liveness or client bootstrapping.",
        "responses": {
          "200": {
            "description": "Service metadata response.",
            "content": {
              "application/json": {
                "schema": {
                  "type": "object",
                  "additionalProperties": true
                }
              }
            }
          }
        },
        "security": []
      }
    },
    "/v1/tools": {
      "get": {
        "operationId": "tool_metadata",
        "tags": [
          "service-discovery"
        ],
        "summary": "Return OpenAI/MCP-compatible compiler tool metadata.",
        "description": "This discovery route is public for liveness or client bootstrapping.",
        "responses": {
          "200": {
            "description": "Service metadata response.",
            "content": {
              "application/json": {
                "schema": {
                  "type": "object",
                  "additionalProperties": true
                }
              }
            }
          }
        },
        "security": []
      }
    },
    "/v1/metrics": {
      "get": {
        "operationId": "service_metrics",
        "tags": [
          "service-discovery"
        ],
        "summary": "Return runtime service metrics without payload data.",
        "description": "This discovery route is public for liveness or client bootstrapping.",
        "responses": {
          "200": {
            "description": "Service metadata response.",
            "content": {
              "application/json": {
                "schema": {
                  "type": "object",
                  "additionalProperties": true
                }
              }
            }
          }
        },
        "security": []
      }
    },
    "/v1/roadmap": {
      "get": {
        "operationId": "years_roadmap",
        "tags": [
          "service-discovery"
        ],
        "summary": "Return the public years-scale compiler roadmap.",
        "description": "This discovery route is public for liveness or client bootstrapping.",
        "responses": {
          "200": {
            "description": "Service metadata response.",
            "content": {
              "application/json": {
                "schema": {
                  "type": "object",
                  "additionalProperties": true
                }
              }
            }
          }
        },
        "security": []
      }
    },
    "/v1/dialect-certification": {
      "get": {
        "operationId": "dialect_certification",
        "tags": [
          "service-discovery"
        ],
        "summary": "Return dialect certification results.",
        "description": "This discovery route is public for liveness or client bootstrapping.",
        "responses": {
          "200": {
            "description": "Service metadata response.",
            "content": {
              "application/json": {
                "schema": {
                  "type": "object",
                  "additionalProperties": true
                }
              }
            }
          }
        },
        "security": []
      }
    },
    "/v1/agent-guide": {
      "get": {
        "operationId": "agent_guide",
        "tags": [
          "service-discovery"
        ],
        "summary": "Return the LLM-facing agent guide.",
        "description": "This discovery route is public for liveness or client bootstrapping.",
        "responses": {
          "200": {
            "description": "Service metadata response.",
            "content": {
              "application/json": {
                "schema": {
                  "type": "object",
                  "additionalProperties": true
                }
              }
            }
          }
        },
        "security": []
      },
      "post": {
        "operationId": "cypher_agent_guide",
        "tags": [
          "compiler-tools"
        ],
        "summary": "Return the machine-readable agent guide: recommended Cypher IR workflow, tool sequences, execution rules, and diagnostic playbooks for LLM clients.",
        "description": "Return the machine-readable agent guide: recommended Cypher IR workflow, tool sequences, execution rules, and diagnostic playbooks for LLM clients. Request bodies are JSON and must stay under 1000000 bytes.",
        "responses": {
          "200": {
            "description": "Compiler tool output.",
            "content": {
              "application/json": {
                "schema": {
                  "type": "object",
                  "additionalProperties": true
                }
              }
            }
          },
          "400": {
            "description": "Invalid JSON request body.",
            "content": {
              "application/json": {
                "schema": {
                  "$ref": "#/components/schemas/ErrorResponse"
                }
              }
            }
          },
          "413": {
            "description": "Request body exceeds the service limit.",
            "content": {
              "application/json": {
                "schema": {
                  "$ref": "#/components/schemas/ErrorResponse"
                }
              }
            }
          },
          "422": {
            "description": "Compiler tool validation or execution error.",
            "content": {
              "application/json": {
                "schema": {
                  "$ref": "#/components/schemas/ErrorResponse"
                }
              }
            }
          }
        },
        "security": [],
        "requestBody": {
          "required": true,
          "content": {
            "application/json": {
              "schema": {
                "type": "object",
                "additionalProperties": false,
                "required": [],
                "properties": {}
              }
            }
          }
        }
      }
    },
    "/v1/diagnostic-catalog": {
      "get": {
        "operationId": "diagnostic_catalog",
        "tags": [
          "service-discovery"
        ],
        "summary": "Return stable diagnostic-code metadata.",
        "description": "This discovery route is public for liveness or client bootstrapping.",
        "responses": {
          "200": {
            "description": "Service metadata response.",
            "content": {
              "application/json": {
                "schema": {
                  "type": "object",
                  "additionalProperties": true
                }
              }
            }
          }
        },
        "security": []
      },
      "post": {
        "operationId": "cypher_diagnostic_catalog",
        "tags": [
          "compiler-tools"
        ],
        "summary": "Return the machine-readable diagnostic catalog: stable codes, severity, source, category, preferred action, and model repair instructions.",
        "description": "Return the machine-readable diagnostic catalog: stable codes, severity, source, category, preferred action, and model repair instructions. Request bodies are JSON and must stay under 1000000 bytes.",
        "responses": {
          "200": {
            "description": "Compiler tool output.",
            "content": {
              "application/json": {
                "schema": {
                  "type": "object",
                  "additionalProperties": true
                }
              }
            }
          },
          "400": {
            "description": "Invalid JSON request body.",
            "content": {
              "application/json": {
                "schema": {